[
  {
    "observationId": "obs-rhetorical-obligation",
    "caseId": "institutional-sacrificial-escalation",
    "observation": "The phrase links the meaning of prior deaths to the continuation and completion of a collective task.",
    "derivedFrom": [
      "pass-gettysburg-dead-not-vain"
    ],
    "observationType": "textual",
    "createdBy": "human",
    "reviewStatus": "draft",
    "notes": "This is a textual relation, not a causal attribution."
  },
  {
    "observationId": "obs-pilot-no-presumption",
    "caseId": "institutional-sacrificial-escalation",
    "observation": "The case design explicitly prohibits treating rhetorical severity as proof of a nonhuman agent.",
    "derivedFrom": [
      "pass-pilot-scope"
    ],
    "observationType": "comparative",
    "createdBy": "human",
    "reviewStatus": "draft",
    "notes": ""
  }
]
